[
  {
    "id": "claim_ycb_006_mustard_bottle_catalog_identity",
    "subject_id": "ycb_006_mustard_bottle",
    "claim_type": "catalog_identity",
    "statement": "The subject is listed as the YCB mustard bottle asset.",
    "status": "supported",
    "value": "listed",
    "unit": null,
    "source_ids": [
      "evidence_ycb_object"
    ],
    "scope": "YCB catalog identity.",
    "limitations": "Catalog identity does not establish a task or execution result."
  },
  {
    "id": "claim_apply_mustard_hotdog_task_suitability",
    "subject_id": "task_apply_mustard_hotdog",
    "claim_type": "task_suitability",
    "statement": "This is a proposed candidate for collection design review.",
    "status": "proposed",
    "value": null,
    "unit": null,
    "source_ids": [
      "evidence_task_atlas_design"
    ],
    "scope": "Mustard planning seed.",
    "limitations": "Requires review and a collection trial."
  },
  {
    "id": "claim_apply_mustard_hotdog_population_frequency",
    "subject_id": "task_apply_mustard_hotdog",
    "claim_type": "population_frequency",
    "statement": "Population frequency for this specific task is unknown.",
    "status": "unknown",
    "value": null,
    "unit": null,
    "source_ids": [],
    "scope": "No defined population or observation protocol.",
    "limitations": "No direct frequency measurement is attached."
  },
  {
    "id": "claim_apply_mustard_hotdog_robot_execution",
    "subject_id": "task_apply_mustard_hotdog",
    "claim_type": "robot_execution",
    "statement": "Robot execution for this task is unknown.",
    "status": "unknown",
    "value": null,
    "unit": null,
    "source_ids": [],
    "scope": "No robot platform or run is attached.",
    "limitations": "A proposed procedure is not an execution result."
  },
  {
    "id": "claim_apply_mustard_hotdog_asset_compatibility",
    "subject_id": "task_apply_mustard_hotdog",
    "claim_type": "asset_compatibility",
    "statement": "Asset compatibility for this task is unknown.",
    "status": "unknown",
    "value": null,
    "unit": null,
    "source_ids": [],
    "scope": "No simulator or asset configuration is attached.",
    "limitations": "YCB identity alone does not validate task assets."
  },
  {
    "id": "claim_apply_mustard_sandwich_task_suitability",
    "subject_id": "task_apply_mustard_sandwich",
    "claim_type": "task_suitability",
    "statement": "This is a proposed candidate for collection design review.",
    "status": "proposed",
    "value": null,
    "unit": null,
    "source_ids": [
      "evidence_task_atlas_design"
    ],
    "scope": "Mustard planning seed.",
    "limitations": "Requires review and a collection trial."
  },
  {
    "id": "claim_apply_mustard_sandwich_population_frequency",
    "subject_id": "task_apply_mustard_sandwich",
    "claim_type": "population_frequency",
    "statement": "Population frequency for this specific task is unknown.",
    "status": "unknown",
    "value": null,
    "unit": null,
    "source_ids": [],
    "scope": "No defined population or observation protocol.",
    "limitations": "No direct frequency measurement is attached."
  },
  {
    "id": "claim_apply_mustard_sandwich_robot_execution",
    "subject_id": "task_apply_mustard_sandwich",
    "claim_type": "robot_execution",
    "statement": "Robot execution for this task is unknown.",
    "status": "unknown",
    "value": null,
    "unit": null,
    "source_ids": [],
    "scope": "No robot platform or run is attached.",
    "limitations": "A proposed procedure is not an execution result."
  },
  {
    "id": "claim_apply_mustard_sandwich_asset_compatibility",
    "subject_id": "task_apply_mustard_sandwich",
    "claim_type": "asset_compatibility",
    "statement": "Asset compatibility for this task is unknown.",
    "status": "unknown",
    "value": null,
    "unit": null,
    "source_ids": [],
    "scope": "No simulator or asset configuration is attached.",
    "limitations": "YCB identity alone does not validate task assets."
  },
  {
    "id": "claim_handover_mustard_to_person_task_suitability",
    "subject_id": "task_handover_mustard_to_person",
    "claim_type": "task_suitability",
    "statement": "This is a proposed candidate for collection design review.",
    "status": "proposed",
    "value": null,
    "unit": null,
    "source_ids": [
      "evidence_task_atlas_design"
    ],
    "scope": "Mustard planning seed.",
    "limitations": "Requires review and a collection trial."
  },
  {
    "id": "claim_handover_mustard_to_person_population_frequency",
    "subject_id": "task_handover_mustard_to_person",
    "claim_type": "population_frequency",
    "statement": "Population frequency for this specific task is unknown.",
    "status": "unknown",
    "value": null,
    "unit": null,
    "source_ids": [],
    "scope": "No defined population or observation protocol.",
    "limitations": "No direct frequency measurement is attached."
  },
  {
    "id": "claim_handover_mustard_to_person_robot_execution",
    "subject_id": "task_handover_mustard_to_person",
    "claim_type": "robot_execution",
    "statement": "Robot execution for this task is unknown.",
    "status": "unknown",
    "value": null,
    "unit": null,
    "source_ids": [],
    "scope": "No robot platform or run is attached.",
    "limitations": "A proposed procedure is not an execution result."
  },
  {
    "id": "claim_handover_mustard_to_person_asset_compatibility",
    "subject_id": "task_handover_mustard_to_person",
    "claim_type": "asset_compatibility",
    "statement": "Asset compatibility for this task is unknown.",
    "status": "unknown",
    "value": null,
    "unit": null,
    "source_ids": [],
    "scope": "No simulator or asset configuration is attached.",
    "limitations": "YCB identity alone does not validate task assets."
  },
  {
    "id": "claim_return_mustard_to_refrigerator_task_suitability",
    "subject_id": "task_return_mustard_to_refrigerator",
    "claim_type": "task_suitability",
    "statement": "This is a proposed candidate for collection design review.",
    "status": "proposed",
    "value": null,
    "unit": null,
    "source_ids": [
      "evidence_task_atlas_design"
    ],
    "scope": "Mustard planning seed.",
    "limitations": "Requires review and a collection trial."
  },
  {
    "id": "claim_return_mustard_to_refrigerator_population_frequency",
    "subject_id": "task_return_mustard_to_refrigerator",
    "claim_type": "population_frequency",
    "statement": "Population frequency for this specific task is unknown.",
    "status": "unknown",
    "value": null,
    "unit": null,
    "source_ids": [],
    "scope": "No defined population or observation protocol.",
    "limitations": "No direct frequency measurement is attached."
  },
  {
    "id": "claim_return_mustard_to_refrigerator_robot_execution",
    "subject_id": "task_return_mustard_to_refrigerator",
    "claim_type": "robot_execution",
    "statement": "Robot execution for this task is unknown.",
    "status": "unknown",
    "value": null,
    "unit": null,
    "source_ids": [],
    "scope": "No robot platform or run is attached.",
    "limitations": "A proposed procedure is not an execution result."
  },
  {
    "id": "claim_return_mustard_to_refrigerator_asset_compatibility",
    "subject_id": "task_return_mustard_to_refrigerator",
    "claim_type": "asset_compatibility",
    "statement": "Asset compatibility for this task is unknown.",
    "status": "unknown",
    "value": null,
    "unit": null,
    "source_ids": [],
    "scope": "No simulator or asset configuration is attached.",
    "limitations": "YCB identity alone does not validate task assets."
  },
  {
    "id": "claim_retrieve_mustard_from_refrigerator_task_suitability",
    "subject_id": "task_retrieve_mustard_from_refrigerator",
    "claim_type": "task_suitability",
    "statement": "This is a proposed candidate for collection design review.",
    "status": "proposed",
    "value": null,
    "unit": null,
    "source_ids": [
      "evidence_task_atlas_design"
    ],
    "scope": "Mustard planning seed.",
    "limitations": "Requires review and a collection trial."
  },
  {
    "id": "claim_retrieve_mustard_from_refrigerator_population_frequency",
    "subject_id": "task_retrieve_mustard_from_refrigerator",
    "claim_type": "population_frequency",
    "statement": "Population frequency for this specific task is unknown.",
    "status": "unknown",
    "value": null,
    "unit": null,
    "source_ids": [],
    "scope": "No defined population or observation protocol.",
    "limitations": "No direct frequency measurement is attached."
  },
  {
    "id": "claim_retrieve_mustard_from_refrigerator_robot_execution",
    "subject_id": "task_retrieve_mustard_from_refrigerator",
    "claim_type": "robot_execution",
    "statement": "Robot execution for this task is unknown.",
    "status": "unknown",
    "value": null,
    "unit": null,
    "source_ids": [],
    "scope": "No robot platform or run is attached.",
    "limitations": "A proposed procedure is not an execution result."
  },
  {
    "id": "claim_retrieve_mustard_from_refrigerator_asset_compatibility",
    "subject_id": "task_retrieve_mustard_from_refrigerator",
    "claim_type": "asset_compatibility",
    "statement": "Asset compatibility for this task is unknown.",
    "status": "unknown",
    "value": null,
    "unit": null,
    "source_ids": [],
    "scope": "No simulator or asset configuration is attached.",
    "limitations": "YCB identity alone does not validate task assets."
  },
  {
    "id": "claim_transport_mustard_to_dining_table_task_suitability",
    "subject_id": "task_transport_mustard_to_dining_table",
    "claim_type": "task_suitability",
    "statement": "This is a proposed candidate for collection design review.",
    "status": "proposed",
    "value": null,
    "unit": null,
    "source_ids": [
      "evidence_task_atlas_design"
    ],
    "scope": "Mustard planning seed.",